{
  "registry_version": "0.3.0",
  "research_cutoff": "2026-08-20",
  "purpose": "Seed registry of trusted sources for a Japanese rewards and payment-route optimizer.",
  "important_notice": "Authority, legal permission, and technical collection feasibility are separate. Do not automate collection until a source-specific policy is approved; a successful or blocked probe does not grant permission.",
  "tier_definitions": {
    "T0_REGULATOR": "Law, regulator, or government guidance.",
    "T1_CANONICAL": "First-party terms, reward rules, product rules, merchant rules, or official technical documentation.",
    "T2_OFFICIAL_SUPPORT": "First-party FAQ, campaign directory, merchant directory, support page, or official explainer.",
    "T3_PARTNER_CONTRACT": "Licensed API, contractual feed, or partner-delivered data. Add only after contract review.",
    "T4_DISCOVERY_ONLY": "Third-party comparison or community signal; never sufficient for production publication."
  },
  "sources": [
    {
      "id": "discovery.cashbackmonitor",
      "name": "Cashback Monitor comparison index",
      "publisher": "Cashback Monitor",
      "category": "discovery",
      "tier": "T4_DISCOVERY_ONLY",
      "publication_use": "discovery_only",
      "source_url": "https://www.cashbackmonitor.com/",
      "authority_scope": [
        "portal_discovery"
      ],
      "locale": "en-US",
      "geography": "US",
      "evidence_format": "html",
      "volatility": "very_high",
      "recommended_check_cadence": "daily",
      "access": {
        "retrieval_method": "http_html",
        "requires_login": false,
        "automation_status": "not_for_production_evidence",
        "terms_review_status": "not_reviewed",
        "technical_feasibility": {
          "current_classification": "unknown",
          "last_observed_at": null,
          "observation_ids": []
        }
      },
      "verification": {
        "url_registered_on": "2026-08-17",
        "content_verified_on": null,
        "status": "registered",
        "notes": "Use only to discover candidate portal changes. Confirm every rate on the portal's official page."
      }
    },
    {
      "id": "global.accor.jal-transfer",
      "name": "ALL Accor to JAL conversion",
      "publisher": "Accor",
      "category": "transfer_rules",
      "tier": "T1_CANONICAL",
      "publication_use": "canonical",
      "source_url": "https://all.accor.com/loyalty-program/partners/use/japanairlines/index.en.shtml",
      "authority_scope": [
        "conversion_ratio",
        "identity_match",
        "processing_time"
      ],
      "locale": "en-US",
      "geography": "GLOBAL",
      "evidence_format": "html",
      "volatility": "high",
      "recommended_check_cadence": "weekly",
      "access": {
        "retrieval_method": "http_html",
        "requires_login": false,
        "automation_status": "requires_terms_review",
        "terms_review_status": "not_reviewed",
        "technical_feasibility": {
          "current_classification": "unknown",
          "last_observed_at": null,
          "observation_ids": []
        }
      },
      "verification": {
        "url_registered_on": "2026-08-17",
        "content_verified_on": null,
        "status": "registered",
        "notes": ""
      }
    },
    {
      "id": "global.accor.partners",
      "name": "ALL Accor partner directory",
      "publisher": "Accor",
      "category": "transfer_rules",
      "tier": "T1_CANONICAL",
      "publication_use": "canonical",
      "source_url": "https://all.accor.com/loyalty-program/partners/index.en.shtml",
      "authority_scope": [
        "transfer_partners",
        "conversion_routes"
      ],
      "locale": "en-US",
      "geography": "GLOBAL",
      "evidence_format": "html",
      "volatility": "high",
      "recommended_check_cadence": "weekly",
      "access": {
        "retrieval_method": "http_html",
        "requires_login": false,
        "automation_status": "requires_terms_review",
        "terms_review_status": "not_reviewed",
        "technical_feasibility": {
          "current_classification": "unknown",
          "last_observed_at": null,
          "observation_ids": []
        }
      },
      "verification": {
        "url_registered_on": "2026-08-17",
        "content_verified_on": null,
        "status": "registered",
        "notes": ""
      }
    },
    {
      "id": "global.hyatt.airline-transfer",
      "name": "World of Hyatt airline transfer partners",
      "publisher": "Hyatt",
      "category": "transfer_rules",
      "tier": "T1_CANONICAL",
      "publication_use": "canonical",
      "source_url": "https://world.hyatt.com/content/gp/en/rewards/air-auto.html",
      "authority_scope": [
        "conversion_ratio",
        "minimum_transfer",
        "bonus_threshold"
      ],
      "locale": "en-US",
      "geography": "GLOBAL",
      "evidence_format": "html",
      "volatility": "high",
      "recommended_check_cadence": "weekly",
      "access": {
        "retrieval_method": "http_html",
        "requires_login": false,
        "automation_status": "requires_terms_review",
        "terms_review_status": "not_reviewed",
        "technical_feasibility": {
          "current_classification": "unknown",
          "last_observed_at": null,
          "observation_ids": []
        }
      },
      "verification": {
        "url_registered_on": "2026-08-17",
        "content_verified_on": null,
        "status": "registered",
        "notes": ""
      }
    },
    {
      "id": "global.ihg.terms",
      "name": "IHG One Rewards terms",
      "publisher": "IHG Hotels & Resorts",
      "category": "program_rules",
      "tier": "T1_CANONICAL",
      "publication_use": "canonical",
      "source_url": "https://www.ihg.com/content/us/en/customer-care/member-tc.html?hideUHF=false",
      "authority_scope": [
        "hotel_program_terms",
        "transfer_rules"
      ],
      "locale": "en-US",
      "geography": "GLOBAL",
      "evidence_format": "html",
      "volatility": "medium",
      "recommended_check_cadence": "monthly",
      "access": {
        "retrieval_method": "http_html",
        "requires_login": false,
        "automation_status": "requires_terms_review",
        "terms_review_status": "not_reviewed",
        "technical_feasibility": {
          "current_classification": "unknown",
          "last_observed_at": null,
          "observation_ids": []
        }
      },
      "verification": {
        "url_registered_on": "2026-08-17",
        "content_verified_on": null,
        "status": "registered",
        "notes": ""
      }
    },
    {
      "id": "global.marriott.bonvoy-terms",
      "name": "Marriott Bonvoy terms",
      "publisher": "Marriott International",
      "category": "program_rules",
      "tier": "T1_CANONICAL",
      "publication_use": "canonical",
      "source_url": "https://www.marriott.com/loyalty/terms/default.mi",
      "authority_scope": [
        "hotel_program_terms",
        "airline_transfer_rules"
      ],
      "locale": "en-US",
      "geography": "GLOBAL",
      "evidence_format": "html",
      "volatility": "medium",
      "recommended_check_cadence": "monthly",
      "access": {
        "retrieval_method": "http_html",
        "requires_login": false,
        "automation_status": "requires_terms_review",
        "terms_review_status": "not_reviewed",
        "technical_feasibility": {
          "current_classification": "unknown",
          "last_observed_at": null,
          "observation_ids": []
        }
      },
      "verification": {
        "url_registered_on": "2026-08-17",
        "content_verified_on": null,
        "status": "registered",
        "notes": ""
      }
    },
    {
      "id": "global.rakuten-us.shopping-trip",
      "name": "Rakuten Shopping Trip tracking",
      "publisher": "Rakuten Rewards",
      "category": "cashback_portal",
      "tier": "T2_OFFICIAL_SUPPORT",
      "publication_use": "canonical",
      "source_url": "https://www.rakuten.com/help/article/what-is-a-rakuten-shopping-trip-360002100588",
      "authority_scope": [
        "attribution_window",
        "tracking_requirements"
      ],
      "locale": "en-US",
      "geography": "US",
      "evidence_format": "html",
      "volatility": "high",
      "recommended_check_cadence": "weekly",
      "access": {
        "retrieval_method": "http_html",
        "requires_login": false,
        "automation_status": "requires_terms_review",
        "terms_review_status": "not_reviewed",
        "technical_feasibility": {
          "current_classification": "unknown",
          "last_observed_at": null,
          "observation_ids": []
        }
      },
      "verification": {
        "url_registered_on": "2026-08-17",
        "content_verified_on": null,
        "status": "registered",
        "notes": ""
      }
    },
    {
      "id": "global.rakuten-us.terms",
      "name": "Rakuten US terms and cashback rules",
      "publisher": "Rakuten Rewards",
      "category": "cashback_portal",
      "tier": "T1_CANONICAL",
      "publication_use": "canonical",
      "source_url": "https://www.rakuten.com/help/article/terms-conditions",
      "authority_scope": [
        "cashback_terms",
        "attribution_rules"
      ],
      "locale": "en-US",
      "geography": "US",
      "evidence_format": "html",
      "volatility": "high",
      "recommended_check_cadence": "weekly",
      "access": {
        "retrieval_method": "http_html",
        "requires_login": false,
        "automation_status": "requires_terms_review",
        "terms_review_status": "not_reviewed",
        "technical_feasibility": {
          "current_classification": "unknown",
          "last_observed_at": null,
          "observation_ids": []
        }
      },
      "verification": {
        "url_registered_on": "2026-08-17",
        "content_verified_on": null,
        "status": "registered",
        "notes": ""
      }
    },
    {